[
  {
    "rule_id": "SYN-MED-ROUTE-CONTINUE",
    "rule_version": "synthetic-insurer-medical-routing-1.0.0",
    "rule_name": "Continue",
    "description": "Continue claim review when KCD/EDI mapping is confident and diagnosis-treatment relation is compatible.",
    "routing": "continue_claim_review",
    "reason_code": "DIAGNOSIS_TREATMENT_COMPATIBLE",
    "default_confidence": 0.82,
    "approval_status": "synthetic_insurer_approved",
    "owner": "Synthetic Insurer A",
    "effective_from": "2026-01-01",
    "effective_to": null,
    "synthetic": true
  },
  {
    "rule_id": "SYN-MED-ROUTE-AMBIGUOUS-CODE",
    "rule_version": "synthetic-insurer-medical-routing-1.0.0",
    "rule_name": "Ambiguous Code",
    "description": "Route to medical reviewer when candidate KCD/EDI confidence margin is below the configured threshold.",
    "routing": "human_review",
    "reason_code": "AMBIGUOUS_MEDICAL_CODE_MAPPING",
    "default_confidence": 0.88,
    "approval_status": "synthetic_insurer_approved",
    "owner": "Synthetic Insurer A",
    "effective_from": "2026-01-01",
    "effective_to": null,
    "synthetic": true
  },
  {
    "rule_id": "SYN-MED-ROUTE-PREEXISTING",
    "rule_version": "synthetic-insurer-medical-routing-1.0.0",
    "rule_name": "Preexisting",
    "description": "Route to medical reviewer when prior diagnosis, test, or continuity evidence suggests possible pre-existing condition review.",
    "routing": "human_review",
    "reason_code": "POSSIBLE_PRE_EXISTING_CONDITION_REVIEW",
    "default_confidence": 0.88,
    "approval_status": "synthetic_insurer_approved",
    "owner": "Synthetic Insurer A",
    "effective_from": "2026-01-01",
    "effective_to": null,
    "synthetic": true
  },
  {
    "rule_id": "SYN-MED-ROUTE-EXCESSIVE-TREATMENT",
    "rule_version": "synthetic-insurer-medical-routing-1.0.0",
    "rule_name": "Excessive Treatment",
    "description": "Route to medical reviewer when repeated same-diagnosis or manual-therapy evidence exceeds synthetic insurer threshold.",
    "routing": "human_review",
    "reason_code": "POSSIBLE_EXCESSIVE_TREATMENT_REVIEW",
    "default_confidence": 0.88,
    "approval_status": "synthetic_insurer_approved",
    "owner": "Synthetic Insurer A",
    "effective_from": "2026-01-01",
    "effective_to": null,
    "synthetic": true
  },
  {
    "rule_id": "SYN-MED-ROUTE-REQUEST-DOCUMENTS",
    "rule_version": "synthetic-insurer-medical-routing-1.0.0",
    "rule_name": "Request Documents",
    "description": "Request additional documents when medical necessity is insufficient or diagnosis-treatment relation needs supporting evidence.",
    "routing": "request_documents",
    "reason_code": "MEDICAL_EVIDENCE_INSUFFICIENT",
    "default_confidence": 0.84,
    "approval_status": "synthetic_insurer_approved",
    "owner": "Synthetic Insurer A",
    "effective_from": "2026-01-01",
    "effective_to": null,
    "synthetic": true
  },
  {
    "rule_id": "SYN-MED-ROUTE-CAUSALITY-REVIEW",
    "rule_version": "synthetic-insurer-medical-routing-1.0.0",
    "rule_name": "Causality Review",
    "description": "Route to medical reviewer when diagnosis and treatment appear weakly related or unrelated.",
    "routing": "human_review",
    "reason_code": "DIAGNOSIS_TREATMENT_RELATION_WEAK",
    "default_confidence": 0.86,
    "approval_status": "synthetic_insurer_approved",
    "owner": "Synthetic Insurer A",
    "effective_from": "2026-01-01",
    "effective_to": null,
    "synthetic": true
  }
]
